{
  "$schema": "../contracts/capability-provider.schema.json",
  "schemaVersion": 1,
  "providerTypes": [
    "runtime_native",
    "canonical_agent",
    "canonical_skill",
    "external_skill",
    "plugin_marketplace",
    "plugin_bundle",
    "mcp_server",
    "hook_script",
    "command",
    "rule_file",
    "dependency_project",
    "memory_provider",
    "graph_provider"
  ],
  "stateModel": {
    "successStates": [
      "unknown",
      "declared",
      "projected",
      "installed",
      "trusted",
      "discoverable",
      "invokable",
      "context_effective",
      "enforcement_effective",
      "verified"
    ],
    "failureStates": [
      "missing_projection",
      "missing_global_install",
      "untrusted",
      "not_discoverable",
      "not_invokable",
      "output_not_consumed",
      "degraded",
      "blocked_for_execution"
    ]
  },
  "runtimes": [
    "claude_code",
    "codex",
    "cursor",
    "openclaw"
  ],
  "operatingSystems": [
    "macos",
    "windows",
    "linux",
    "wsl2"
  ],
  "installLayers": [
    "runtime_native",
    "canonical_source",
    "project_projection",
    "global_home",
    "plugin_marketplace",
    "plugin_bundle",
    "mcp_config",
    "command_path",
    "rule_projection",
    "dependency_registry",
    "memory_service",
    "graph_index"
  ],
  "mappingPolicy": {
    "skillsManifest": {
      "sourceRef": "config/skills.json",
      "required": true,
      "notes": "Every skill manifest id must map to at least one provider."
    },
    "dependencyProjectRegistry": {
      "sourceRef": "config/capability-index/dependency-project-registry.json",
      "required": true,
      "notes": "Every dependency project id must map to at least one provider; this does not imply execution eligibility."
    },
    "runtimeCapabilityMatrix": {
      "sourceRef": "config/runtime-capability-matrix.json",
      "required": true,
      "notes": "Every formal runtime projection must have a runtime_native provider."
    },
    "weaponRegistry": {
      "sourceRef": "config/capability-index/weapon-registry.json",
      "required": true,
      "notes": "Every weapon id must map to a provider or provider group with a verification command."
    }
  },
  "providers": [
    {
      "id": "runtime-native-claude-code",
      "providerType": "runtime_native",
      "summary": "Claude Code formal runtime projection and native capability surface.",
      "sourceOfTruth": "config/runtime-capability-matrix.json",
      "mappings": {
        "runtimeMatrixPlatforms": [
          "claude_code"
        ],
        "capabilityInventoryTypes": [
          "runtime_tool"
        ]
      },
      "activation": {
        "installLayers": [
          "runtime_native",
          "project_projection",
          "global_home"
        ],
        "trigger": "Claude Code project/global runtime config",
        "outputConsumption": "runtime_call"
      },
      "verification": {
        "method": "matrix and runtime sync validation",
        "command": "npm run meta:check:runtimes"
      },
      "risk": {
        "trustReview": "native_runtime",
        "notes": [
          "Do not replace native capabilities with Meta_Kim abstractions."
        ]
      },
      "support": {
        "default": {
          "state": "verified",
          "status": "verified",
          "installLayers": {
            "runtime_native": "verified",
            "project_projection": "verified",
            "global_home": "partial"
          },
          "os": {
            "macos": "partial",
            "windows": "partial",
            "linux": "partial",
            "wsl2": "partial"
          }
        },
        "runtimes": {
          "claude_code": {
            "state": "verified",
            "status": "verified",
            "installLayers": {
              "runtime_native": "verified",
              "project_projection": "verified",
              "global_home": "partial"
            },
            "os": {
              "macos": "partial",
              "windows": "partial",
              "linux": "partial",
              "wsl2": "partial"
            }
          }
        }
      },
      "providerKind": "runtime_native",
      "capabilities": [
        "Claude Code formal runtime projection and native capability surface.",
        "runtime_tool"
      ],
      "source": {
        "sourceOfTruth": "config/runtime-capability-matrix.json",
        "mappings": {
          "runtimeMatrixPlatforms": [
            "claude_code"
          ],
          "capabilityInventoryTypes": [
            "runtime_tool"
          ]
        }
      },
      "trust": {
        "review": "native_runtime",
        "required": false
      },
      "installMethod": "runtimeNative",
      "installLayers": [
        "runtime_native",
        "project_projection",
        "global_home"
      ],
      "exposedArtifacts": [
        "config/runtime-capability-matrix.json"
      ],
      "activationEvents": [
        "Claude Code project/global runtime config"
      ],
      "outputContracts": {
        "consumption": "runtime_call",
        "mustEnterModelContext": false,
        "mustEnforcePolicy": false
      },
      "safetyBoundary": {
        "trustReview": "native_runtime",
        "notes": [
          "Do not replace native capabilities with Meta_Kim abstractions."
        ]
      },
      "runtimeAdapters": {
        "claude_code": {
          "state": "verified",
          "status": "verified",
          "installLayers": {
            "runtime_native": "verified",
            "project_projection": "verified",
            "global_home": "partial"
          },
          "activationEvent": "Claude Code project/global runtime config",
          "outputContract": "runtime_call",
          "reason": null
        },
        "codex": {
          "state": "verified",
          "status": "verified",
          "installLayers": {
            "runtime_native": "verified",
            "project_projection": "verified",
            "global_home": "partial"
          },
          "activationEvent": "Claude Code project/global runtime config",
          "outputContract": "runtime_call",
          "reason": null
        },
        "cursor": {
          "state": "verified",
          "status": "verified",
          "installLayers": {
            "runtime_native": "verified",
            "project_projection": "verified",
            "global_home": "partial"
          },
          "activationEvent": "Claude Code project/global runtime config",
          "outputContract": "runtime_call",
          "reason": null
        },
        "openclaw": {
          "state": "verified",
          "status": "verified",
          "installLayers": {
            "runtime_native": "verified",
            "project_projection": "verified",
            "global_home": "partial"
          },
          "activationEvent": "Claude Code project/global runtime config",
          "outputContract": "runtime_call",
          "reason": null
        }
      },
      "osAdapters": {
        "macos": {
          "status": "partial",
          "risks": [
            "Do not replace native capabilities with Meta_Kim abstractions."
          ]
        },
        "windows": {
          "status": "partial",
          "risks": [
            "Do not replace native capabilities with Meta_Kim abstractions."
          ]
        },
        "linux": {
          "status": "partial",
          "risks": [
            "Do not replace native capabilities with Meta_Kim abstractions."
          ]
        },
        "wsl2": {
          "status": "partial",
          "risks": [
            "Do not replace native capabilities with Meta_Kim abstractions."
          ]
        }
      },
      "degradation": {
        "statusByRuntime": {
          "claude_code": "none",
          "codex": "none",
          "cursor": "none",
          "openclaw": "none"
        },
        "reason": null
      },
      "owner": "meta-sentinel",
      "reviewOwner": "meta-prism",
      "evolutionKey": "provider:runtime-native-claude-code"
    },
    {
      "id": "runtime-native-codex",
      "providerType": "runtime_native",
      "summary": "Codex formal runtime projection, AGENTS rules, hooks, agents, commands, and MCP TOML baseline.",
      "sourceOfTruth": "config/runtime-capability-matrix.json",
      "mappings": {
        "runtimeMatrixPlatforms": [
          "codex"
        ],
        "capabilityInventoryTypes": [
          "runtime_tool"
        ]
      },
      "activation": {
        "installLayers": [
          "runtime_native",
          "project_projection",
          "global_home"
        ],
        "trigger": "Codex project AGENTS.md and .codex config",
        "outputConsumption": "runtime_call"
      },
      "verification": {
        "method": "matrix and runtime sync validation",
        "command": "npm run meta:check:runtimes"
      },
      "risk": {
        "trustReview": "native_runtime",
        "notes": [
          "Hook coverage is runtime-version dependent; do not treat it as an all-tool policy engine."
        ]
      },
      "support": {
        "default": {
          "state": "verified",
          "status": "verified",
          "installLayers": {
            "runtime_native": "verified",
            "project_projection": "verified",
            "global_home": "partial"
          },
          "os": {
            "macos": "partial",
            "windows": "partial",
            "linux": "partial",
            "wsl2": "partial"
          }
        },
        "runtimes": {
          "codex": {
            "state": "verified",
            "status": "verified",
            "installLayers": {
              "runtime_native": "verified",
              "project_projection": "verified",
              "global_home": "partial"
            },
            "os": {
              "macos": "partial",
              "windows": "partial",
              "linux": "partial",
              "wsl2": "partial"